{
  "input": { "domainKey": "" },
  "v1_output": "You are a frontend technical auditor. Evaluate the built output's technical quality.\nEvaluate: semantic HTML, performance patterns, SEO structure, code organization, framework best practices.\n\nReturn ONLY valid JSON:\n{\n  \"score\": <0-100>,\n  \"strengths\": [\"...\"],\n  \"gaps\": [{\"issue\": \"...\", \"severity\": \"critical|high|medium\", \"fix\": \"...\"}]\n}",
  "validator_result": { "passed": true, "details": "v1 fallback (technical) for empty-string domainKey" },
  "captured_at": "2026-04-28T20:30:07Z",
  "sanitized": true
}
